{
  "schemaVersion": 1,
  "quote": {
    "label": "Wholesale quotation",
    "description": "Confirmed by quantity and destination"
  },
  "inquiry": {
    "href": "inquiry.html",
    "primaryLabel": "Start an inquiry",
    "secondaryLabel": "Start inquiry"
  },
  "languages": [
    "en",
    "zh-CN",
    "zh-TW",
    "ru",
    "ar",
    "es",
    "pt"
  ],
  "id": "sj250",
  "name": "SJ250",
  "series": "SJ Series",
  "powerType": "gasoline-two-stroke",
  "page": {
    "title": "SJ250 | Apex Moto Supply",
    "description": "SJ250 two-stroke off-road motorcycle specifications and wholesale inquiry."
  },
  "intro": "A lightweight two-stroke off-road motorcycle built for sharp response, strong control and distributor-ready supply.",
  "category": "SJ Series / Two-stroke off-road",
  "panelImage": "../assets/img/sj250-gallery/sj250-hero-panel-industrial-red-v11-master.png",
  "gallery": [
    {
      "src": "../assets/img/sj250-gallery/sj250-angle-01-front-dark-ultrawide-v4.png",
      "alt": "SJ250 head-on front dark industrial studio view",
      "angle": "front"
    },
    {
      "src": "../assets/img/sj250-gallery/sj250-angle-02-left-front-half-dark-ultrawide-v4.png",
      "alt": "SJ250 left-front half-angle dark industrial studio view",
      "angle": "left-front"
    },
    {
      "src": "../assets/img/sj250-gallery/sj250-angle-03-left-dark-ultrawide-v4.png",
      "alt": "SJ250 left-side dark industrial studio view",
      "angle": "left-side"
    },
    {
      "src": "../assets/img/sj250-gallery/sj250-angle-04-left-rear-half-dark-ultrawide-v4.png",
      "alt": "SJ250 left-rear half-angle dark industrial studio view",
      "angle": "left-rear"
    },
    {
      "src": "../assets/img/sj250-gallery/sj250-angle-05-rear-dark-ultrawide-v4.png",
      "alt": "SJ250 straight rear dark industrial studio view",
      "angle": "rear"
    }
  ],
  "stats": [
    {
      "label": "Maximum power",
      "value": "25",
      "unit": "kW"
    },
    {
      "label": "Engine",
      "value": "2T",
      "unit": ""
    },
    {
      "label": "Fuel tank",
      "value": "5.3",
      "unit": "L"
    },
    {
      "label": "Kerb weight",
      "value": "105",
      "unit": "kg"
    }
  ],
  "sellingPoints": [
    {
      "title": "Explosive two-stroke power",
      "description": "MT250 engine, 25 kW and 30 N·m",
      "icon": "power"
    },
    {
      "title": "Lightweight control",
      "description": "105 kg kerb weight",
      "icon": "feather"
    },
    {
      "title": "Trail-range fuel system",
      "description": "5.3 L tank; 100 km endurance at ≤50 km/h",
      "icon": "fuel"
    },
    {
      "title": "Long-travel suspension",
      "description": "838 mm front and 509 mm rear shock units",
      "icon": "shock"
    }
  ],
  "overview": {
    "title": "Product overview",
    "body": "SJ250 combines an MT250 two-stroke engine with a 105 kg kerb weight, long-travel suspension and full-size 21/18-inch wheels for fast response across trails, training grounds and demanding off-road terrain.",
    "miniSpecs": [
      {
        "title": "MT250 two-stroke engine",
        "description": "25 kW output and 30 N·m torque for immediate throttle response.",
        "icon": "engine"
      },
      {
        "title": "105 kg kerb weight",
        "description": "Light mass supports quick direction changes and easier recovery.",
        "icon": "chassis"
      },
      {
        "title": "Long-travel suspension",
        "description": "838 mm front and 509 mm rear shock units absorb rough terrain.",
        "icon": "suspension"
      },
      {
        "title": "Full disc brakes",
        "description": "Front and rear disc brakes provide consistent off-road control.",
        "icon": "brakes"
      }
    ]
  },
  "highlights": [
    {
      "title": "MT250 two-stroke engine",
      "description": "Two-stroke engine and expansion chamber for direct off-road response.",
      "image": "../assets/img/sj250-gallery/sj250-highlight-01-engine-power-dark-v4.png",
      "alt": "SJ250 MT250 two-stroke engine and expansion chamber in a dark industrial studio"
    },
    {
      "title": "Long-travel front fork",
      "description": "Front fork and front disc brake assembly for rough-terrain control.",
      "image": "../assets/img/sj250-gallery/sj250-highlight-02-front-fork-dark-v4.png",
      "alt": "SJ250 long-travel front fork and front disc brake in a dark industrial studio"
    },
    {
      "title": "Rear hub and chain drive",
      "description": "Rear hub, chain drive and rear disc brake hardware.",
      "image": "../assets/img/sj250-gallery/sj250-highlight-03-rear-drivetrain-dark-v4.png",
      "alt": "SJ250 rear hub, chain drive and rear disc brake in a dark industrial studio"
    },
    {
      "title": "5.3 L fuel tank",
      "description": "Clear fuel-tank contour and filler cap.",
      "image": "../assets/img/sj250-gallery/sj250-highlight-04-fuel-tank-dark-v4.png",
      "alt": "SJ250 5.3 L fuel tank and filler cap in a dark industrial studio"
    }
  ],
  "banner": {
    "image": "../assets/img/sj250-gallery/sj250-angle-02-left-front-half-dark-ultrawide-v4.png",
    "alt": "SJ250 dark industrial studio view"
  },
  "technical": {
    "title": "SJ250 technical specifications",
    "subtitle": "Complete factory parameter list",
    "groups": [
      {
        "title": "Vehicle dimensions",
        "items": [
          {
            "label": "Dimensions",
            "value": "2120 × 800 × 1235 mm"
          },
          {
            "label": "Wheelbase",
            "value": "1440 mm"
          },
          {
            "label": "Ground clearance",
            "value": "340 mm"
          },
          {
            "label": "Seat height",
            "value": "910 mm"
          },
          {
            "label": "Kerb weight",
            "value": "105 kg"
          },
          {
            "label": "Maximum load",
            "value": "150 kg"
          },
          {
            "label": "Front tire",
            "value": "90/90-21"
          },
          {
            "label": "Rear tire",
            "value": "140/80-18"
          }
        ]
      },
      {
        "title": "Chassis configuration",
        "items": [
          {
            "label": "Brake modes",
            "value": "Front and rear disc brakes"
          },
          {
            "label": "Front shock absorber",
            "value": "Length 838 mm"
          },
          {
            "label": "Rear shock absorber",
            "value": "Length 509 mm"
          },
          {
            "label": "Transmission",
            "value": "Chain drive 520 / 110L / 42T"
          },
          {
            "label": "Sprocket",
            "value": "Alloy"
          },
          {
            "label": "Light",
            "value": "LED"
          },
          {
            "label": "Fuel tank",
            "value": "5.3 L"
          },
          {
            "label": "Endurance",
            "value": "100 km at ≤ 50 km/h"
          }
        ]
      },
      {
        "title": "Power system",
        "items": [
          {
            "label": "Model",
            "value": "SJ250"
          },
          {
            "label": "Top speed",
            "value": "110 km/h"
          },
          {
            "label": "Maximum climbing angle",
            "value": ">70°"
          },
          {
            "label": "Engine type",
            "value": "MT250 two-stroke"
          },
          {
            "label": "Maximum torque",
            "value": "30 N·m"
          },
          {
            "label": "Maximum power",
            "value": "25 kW"
          },
          {
            "label": "Starter battery",
            "value": "2 A Li-ion battery"
          }
        ]
      }
    ]
  },
  "translations": {
    "en": {
      "25": "25",
      "105": "105",
      "Wholesale quotation": "Wholesale quotation",
      "Start an inquiry": "Start an inquiry",
      "Start inquiry": "Start inquiry",
      "sj250": "sj250",
      "SJ250": "SJ250",
      "SJ Series": "SJ 系列",
      "gasoline-two-stroke": "gasoline-two-stroke",
      "A lightweight two-stroke off-road motorcycle built for sharp response, strong control and distributor-ready supply.": "A lightweight two-stroke off-road motorcycle built for sharp response, strong control and distributor-ready supply.",
      "SJ Series / Two-stroke off-road": "SJ 系列 / 两冲程越野",
      "Maximum power": "Maximum power",
      "kW": "kW",
      "Engine": "Engine",
      "2T": "2T",
      "": "",
      "Fuel tank": "Fuel tank",
      "5.3": "5.3",
      "L": "L",
      "Kerb weight": "Kerb weight",
      "kg": "kg",
      "power": "power",
      "feather": "feather",
      "fuel": "fuel",
      "shock": "shock",
      "SJ250 combines an MT250 two-stroke engine with a 105 kg kerb weight, long-travel suspension and full-size 21/18-inch wheels for fast response across trails, training grounds and demanding off-road terrain.": "SJ250 combines an MT250 two-stroke engine with a 105 kg kerb weight, long-travel suspension and full-size 21/18-inch wheels for fast response across trails, training grounds and demanding off-road terrain.",
      "engine": "engine",
      "chassis": "chassis",
      "suspension": "suspension",
      "brakes": "brakes",
      "Complete factory parameter list": "完整出厂参数表",
      "Dimensions": "Dimensions",
      "2120 × 800 × 1235 mm": "2120 × 800 × 1235 mm",
      "Wheelbase": "Wheelbase",
      "1440 mm": "1440 mm",
      "Ground clearance": "Ground clearance",
      "340 mm": "340 mm",
      "Seat height": "Seat height",
      "910 mm": "910 mm",
      "105 kg": "105 kg",
      "Maximum load": "Maximum load",
      "150 kg": "150 kg",
      "Front tire": "Front tire",
      "90/90-21": "90/90-21",
      "Rear tire": "Rear tire",
      "140/80-18": "140/80-18",
      "Brake modes": "Brake modes",
      "Front and rear disc brakes": "Front and rear disc brakes",